sentence_id,question,Keziah,Kathryn,Karim,Keziah reason,Kathryn reason,Karim reason,article_id,model,dataset,human_salience
4,Can the price of the Tesla Model S Plaid and other hypercars be justified in terms of their performance in comparison to the Dodge Challenger SRT Demon 170?,4.0,5,4,provides more information about the cost/features,This question could be important in understanding how the Challenger's performance relative to its price range.,"Expands on information introduced, connects back to main idea",1,gpt4,diversesumm,4.333333333333333
7,What is the significance of the 170 in the Dodge Challenger SRT Demon 170's name?,0.0,0,0,anchored in sentence 2,This question seems to be anchored in a previous sentence.,"Doesn't seem to be anchored here, closest mention of name is sentence 4",1,gpt4,diversesumm,0.0
7,Who is Tim Kuniskis and what is his role in the development of the Demon 170?,2.0,2,2,answered by the anchor,Sentence 7 already explains that Tim Kuniskis is the CEO of Dodge.,Answered in sentence 7,1,gpt4,diversesumm,2.0
7,How does the Demon 170 differ from the previous models like the Challenger Hellcat or the 2018 Challenger SRT Demon?,4.0,5,5,provides more information about the car models,This question could help in understanding the features of the car in relation to other Dodge cars.,"Asks about newly introduced idea, central to main theme. Claim + evidence to that claim being set up.",1,gpt4,diversesumm,4.666666666666667
7,Why is Kuniskis insistent that the new car isn't merely an upgraded version of previous models?,3.0,4,3,does not increase my personal understanding (focused more on Kuniskis' opinion than the car models themselves),This question could give some context to how Dodge is marketing the 2023 Challenger.,"Something to be assumed, seems to be a call back to new models not really being new or he just wants to emphasize new creation. Explicit answer to this not necessary.",1,gpt4,diversesumm,3.333333333333333
7,What are the unique features or technologies in the Demon 170 that distinguish it from the Challenger Hellcat or the 2018 Challenger SRT Demon?,4.0,5,5,provides more information about the car models,This question would be helpful in understanding how the 2023 Challenger is improved.,"Asks about newly introduced idea, central to main theme. Claim + evidence to that claim being set up.",1,gpt4,diversesumm,4.666666666666667
10,What specific functions do the pistons perform in the engine of the Dodge Challenger SRT Demon 170?,3.0,3,3,does not increase my personal understanding about why the model is worth buying,"This question is about the specific mechanics of the 2023 Challenger, which won't help my understanding of why these parts needed to be replaced so the engine doesn't self-destruct.",Goes into car mechanics and away from Challenger/main topic,1,gpt4,diversesumm,3.0
10,What role does the crankshaft play in all these updates in the engine components?,3.0,3,3,does not increase my personal understanding,"This question is about the specific mechanics of the 2023 Challenger, which won't help my understanding of why these parts needed to be replaced so the engine doesn't self-destruct.",Goes into car mechanics and away from Challenger/main topic,1,gpt4,diversesumm,3.0
10,What are crank bearings and what is their importance in an engine's performance?,3.0,3,3,does not increase my personal understanding,"This question is about the specific mechanics of the 2023 Challenger, which won't help my understanding of why these parts needed to be replaced so the engine doesn't self-destruct.",Goes into car mechanics and away from Challenger/main topic,1,gpt4,diversesumm,3.0
10,How do the billet main caps contribute to the overall operation of the engine?,3.0,3,3,does not increase my personal understanding,"This question is about the specific mechanics of the 2023 Challenger, which won't help my understanding of why these parts needed to be replaced so the engine doesn't self-destruct.",Goes into car mechanics and away from Challenger/main topic,1,gpt4,diversesumm,3.0
10,What are the connecting rods and how do they interact with the other replaced components?,3.0,3,3,does not increase my personal understanding,"This question is about the specific mechanics of the 2023 Challenger, which won't help my understanding of why these parts needed to be replaced so the engine doesn't self-destruct.",Goes into car mechanics and away from Challenger/main topic,1,gpt4,diversesumm,3.0
13,How large is the Demon 170's fuel tank?,3.0,4,4,does not increase my personal understanding,"This question could give more context, on how fast the 2023 Challenger goes through fuel.","Expands on information introduced, Challenger's qualities",1,gpt4,diversesumm,3.6666666666666665
13,What is the average fuel consumption rate of the Demon 170 under full-throttle driving conditions?,4.0,5,4,this question is better than the previous one because it frames fuel tank size in the context of fuel consumption rate,This question could give important context on why the fuel drains so fast in the 2023 Challenger.,"Expands on information introduced, Challenger's qualities",1,gpt4,diversesumm,4.333333333333333
13,Can the Demon 170's fuel tank be modified to hold more fuel for longer durations of full-throttle driving?,4.0,4,3,provides information on how buyers could potentially alter the model for their standards,This question could help in understanding how the 2023 Challenger might be modified for daily use.,"Not sure if modifications usually introduced with car articles, but seems off topic",1,gpt4,diversesumm,3.6666666666666665
13,What fuels can the Demon 170 use that would allow for longer periods of full-throttle driving?,4.0,5,3,provides information about how the model can be used,This question is useful in understanding the practical use of the 2023 Challenger.,Nothing in the article implies that this car can hold full throttle for longer than what was mentioned,1,gpt4,diversesumm,4.0
13,How does the quick drainage of the fuel tank in full-throttle driving impact the overall performance and efficiency of the Demon 170?,4.0,5,4,provides more information about performance,This question is useful in understanding the full impact of the concerns on the fuel tank.,"Expands on question introduced, relates to Challenger's capabilities",1,gpt4,diversesumm,4.333333333333333
16,What changes in the engine configuration cause the output to fall when running on premium gas compared to E85 fuel?,3.0,4,4,does not increase my personal understanding,This question could add some useful context on why E85 fuel is needed.,"Expands on idea introduced, the ""why"" to new information about Challenger",1,gpt4,diversesumm,3.6666666666666665
16,How does the performance of the car change when it operates on 900 hp and 810 lb-ft compared to its full power?,4.0,4,2,provides more information about performance,This question could provide some context on how significant the change in performance is on premium gas.,That IS the performance of the car.,1,gpt4,diversesumm,3.333333333333333
16,Is there a significant difference in the vehicle's fuel consumption when switching between E85 and premium gas?,3.0,4,4,does not increase my personal understanding,This question could be useful in understanding which is the better fuel to use.,Expands on information introduced,1,gpt4,diversesumm,3.6666666666666665
16,What is the reason behind the car being able to operate on two different kinds of fuel?,3.0,3,3,does not increase my personal understanding,"This question doesn't interest me, as it doesn't seem like a specific design choice to have the car run on multiple types of gas.","Car mechanics, extra info",1,gpt4,diversesumm,3.0
16,Are any modifications required for the car to switch between E85 and premium gas?,3.0,4,3,does not increase my personal understanding,This question could give some context on how the car could be optimized for regular use.,"Nothing implies modifications are required, sentence 16 states it can also run on premium gas",1,gpt4,diversesumm,3.333333333333333
4,What is the difference between the Tesla Model S Plaid and the other Tesla models,3.0,3,3,does not increase my personal understanding of the Challenger,"The article is on the 2023 Challenger, so I'm not interested in this question.","Off topic, this is about the Challenger",1,llama,diversesumm,3.0
4,How does the Demon 170 compare to the Tesla Model S Plaid in terms of acceleration,4.0,4,4,gives more information about specifications,"This question could give some context, on the performamce of the 2023 Challenger relative to it's price.","Expands on idea introduced, still focuses on Challenger",1,llama,diversesumm,4.0
4,"Why does the sentence say ""as far as straight-line performance is concerned""",3.0,3,3,does not increase my personal understanding,"I'm not interested in this question, as the meaning should be inferred from the original sentence.",Don't need reason/more clarification on phrase in sentence,1,llama,diversesumm,3.0
4,"What does the author mean by ""a handful of supercars and hypercars""",2.0,3,3,an answer can be inferred from the text,Knowing the specific supercars and hypercars won't necessarily help my understanding.,"Meaning of phrase very clear already, this isn't asking just for the def of supercars and hypercars but what the author means by a HANDFUL of them.",1,llama,diversesumm,2.6666666666666665
4,Can you name some of the supercars and hypercars mentioned in the sentence,3.0,3,3,does not increase my personal understanding,Knowing the specific supercars and hypercars won't necessarily help my understanding.,"Author chose to exclude names, extraneous information",1,llama,diversesumm,3.0
7,"What does the word ""Power-Drunk"" mean in this context",2.0,3,3,can be inferred from the text,This question should be inferred from the original sentence.,The phrases implication is clear,1,llama,diversesumm,2.6666666666666665
7,How many Hellcats did Dodge build between 2015 and 2023,3.0,3,3,does not increase my personal understanding,"The article is not focused on this model, so I'm not interested in the question.","Off-topic, article is not about Hellcats",1,llama,diversesumm,3.0
7,"Why is the Demon 170 a ""street-legal drag racer""",0.0,0,0,anchored in sentence 2,This question seems to be anchored in sentence 2.,Anchored in sentence 2,1,llama,diversesumm,0.0
7,Is there a difference between the Demon 170 and the 2018 Challenger SRT Demon,4.0,4,4,asks for more information about the model,"This question could give some context, on the features and improvement of the 2023 Challenger.","Oddly phrased but this expands on information introduced and could give us more context between how the Demon 170 isn't just an ""upgrade""",1,llama,diversesumm,4.0
7,Does the Demon 170 have a V-8 engine,2.0,4,2,the question is a bit unrelated and makes an inference jump about the V-8 (only briefly mentioned as a title in the sentence 7 context),"This question is very specific, but it could give more information on the features of the 2023 Challenger.",Can be inferred from sentence 7,1,llama,diversesumm,2.6666666666666665
10,What are the new pistons made of,3.0,4,3,does not increase my personal understanding (specifications about the car in general rather than a specific part would be more useful),"This question could give some context on how the new parts help the performance of the car, though it is very specific.",Unrelated to article,1,llama,diversesumm,3.333333333333333
10,What are the connecting rods made of,3.0,4,3,does not increase my personal understanding (specifications about the car in general rather than a specific part would be more useful),"This question could give some context on how the new parts help the performance of the car, though it is very specific.",Unrelated to article,1,llama,diversesumm,3.333333333333333
10,What is the crankshaft made of,3.0,4,3,does not increase my personal understanding (specifications about the car in general rather than a specific part would be more useful),"This question could give some context on how the new parts help the performance of the car, though it is very specific.",Unrelated to article,1,llama,diversesumm,3.333333333333333
10,What are the crank bearings made of,3.0,4,3,does not increase my personal understanding (specifications about the car in general rather than a specific part would be more useful),"This question could give some context on how the new parts help the performance of the car, though it is very specific.",Unrelated to article,1,llama,diversesumm,3.333333333333333
10,What are the billet main caps made of,3.0,4,3,does not increase my personal understanding (specifications about the car in general rather than a specific part would be more useful),"This question could give some context on how the new parts help the performance of the car, though it is very specific.",Unrelated to article,1,llama,diversesumm,3.333333333333333
13,What does 'full-throttle' mean in this context,2.0,3,2,can be inferred from the text,This question should be inferred from the original sentence.,"Answered in sentence 13, don't need more clarification",1,llama,diversesumm,2.333333333333333
13,How long does it take to drain the fuel tank,2.0,2,2,answered in sentence 7,"This question is answered in sentence 13, which explains that it takes less than 7 minutes.","Vague question, but an answer given in sentence 13",1,llama,diversesumm,2.0
13,Why would you want to drain the fuel tank,3.0,3,3,does not increase my personal understanding,This question doesn't help my understanding of why the car drains fuel so quickly.,"""you"" question, not related to main topic",1,llama,diversesumm,3.0
13,Is there a reason why the fuel injectors can flow up to 164 gallons per hour,0.0,0,0,anchored in sentence 12,This question seems to be anchored in sentence 12.,Anchored in sentence 12,1,llama,diversesumm,0.0
13,Does the engine use a different type of fuel than regular gasoline,4.0,4,4,could provide more information about the car,This question could give some context on what makes the 2023 Challnger's fuel tank so unusual.,"Expands on information introduced, related to main topic",1,llama,diversesumm,4.0
16,What does the word 'mere' mean in this context,2.0,3,2,can be inferred from the text,This question should be inferred from the original sentence.,Don't need clarification on word used,1,llama,diversesumm,2.333333333333333
16,"Why would output fall to a mere 900 hp and 810 lb-ft if the Demon 170 can produce 1,025 hp and 945 lb-ft",2.0,2,2,answered by sentence 16,"This question is already answered in sentence 16, which explains that running the car on premium gas will drop its performance.",Answered in sentence 16 bc of premium gas instead of E85,1,llama,diversesumm,2.0
16,How much less does E85 cost than premium unleaded,0.0,0,0,anchored in sentence 15,This question seems to be anchored in sentence 15.,Anchored in sentence 15,1,llama,diversesumm,0.0
16,How many gallons of E85 can fit in the Demon 170's fuel tank,4.0,4,4,gives more information about the car specs,This question could give some context on the fuel efficiency and practivalmuse of the 2023 Challenger.,"Question based on information presented, relates to main topic",1,llama,diversesumm,4.0
16,What is the name of the company that makes the fuel injectors used in the Demon 170,0.0,0,0,anchored in sentence 12,This question seems to be anchored in sentence 12.,Anchored sentence 12,1,llama,diversesumm,0.0
4,What is the name of the car that competes against the Demon 170?,2.0,2,2,answered by the anchor (sentence 4),"This question is already answered in sentence 4, which names the Tesla Model S Plaid as the main competition to the 2023 Challenger.",Sentence 4 gives us a name,1,mistral,diversesumm,2.0
4,How many wheels does the Tesla Model S Plaid use?,3.0,3,2,does not increase my personal understanding of the Challenger,"The article is focused on the 2023 Challenger, and there is no indication that the Tesla uses less or more than 4 wheels.","""all of which"" sentence 4 tells us it uses four wheels",1,mistral,diversesumm,2.6666666666666665
4,Is there more than one model or variant of the Tesla Model S Plaid?,3.0,3,3,does not increase my personal understanding of the Challenger,"The article is focused on the 2023 Challenger, so I'm not interested in this question.","Off topic, article focuses on Challenger",1,mistral,diversesumm,3.0
4,Which supercars and hypercars does the Demon 170 compete against?,3.0,3,3,does not increase my personal understanding of the Challenger,Knowing the specific supercars and hypercars won't necessarily help my understanding.,"Author chose not to mention names, this is extra information",1,mistral,diversesumm,3.0
4,What is the difference between the Demon 170 and the Tesla Model S Plaid in terms of speed?,4.0,4,4,gives insight into car performance,This question could give some context on how the 2023 Challenger performs relative to its price range.,"Expands on idea introduced, comparison relates to main idea",1,mistral,diversesumm,4.0
7,What is the name of the vehicle?,2.0,2,2,answered by sentence 2,"This question is already answered in previous context, which explains the vehicle is the 2023 Dodge Challenger SRT Demon 170.","Name of vehicle in question mentioned previously, sentence 2/3",1,mistral,diversesumm,2.0
7,How many horsepower does the vehicle have?,2.0,2,2,answered by sentence 2,"This question is already explained in sentence 2, which states the vehicle has a 1,025 horse power.",Sentence 2 answers this,1,mistral,diversesumm,2.0
7,What is the claimed 0-60 time for the vehicle?,2.0,2,2,answered by sentence 3,"This question is already answered in sentence 2, which states that the 0-60 time is 1.66 seconds.",Sentence 2 answers this,1,mistral,diversesumm,2.0
7,What is the claimed quarter mile time for the vehicle?,2.0,2,2,answered by sentence 4,"This question is already answered in sentence 2, which states that the quarter mile time is 8.91 seconds.",Sentence 2 answers this,1,mistral,diversesumm,2.0
7,What is the starting price of the vehicle?,2.0,2,2,answered by sentence 6,"This question could give some context on how the 2023 Challenger performs relative to its price range. (Question seems to be answered in sentence 6, with a starting price around $100,361)",Sentence 6 answers this,1,mistral,diversesumm,2.0
10,What was the reason behind replacing the pistons?,2.0,4,2,answered by sentence 9 (to keep the car from self-destructing),This question could give some context on how the new parts keep the engine from self-destructing.,"Sentence 9 tells us its to keep engine from self destructing, can also be interpreted as WHY the pistons specifically, if so, 3 for details I don't need",1,mistral,diversesumm,2.6666666666666665
10,Why were the connecting rods replaced?,2.0,4,2,answered by sentence 9 (to keep the car from self-destructing),This question could give some context on how the new parts keep the engine from self-destructing.,Sentence 9 tells us its to keep engine from self destructing,1,mistral,diversesumm,2.6666666666666665
10,How did the crankshaft affect the engine's power output?,3.0,3,3,does not increase my personal understanding,"This question is about specific mechanics of the car, which won't help my understanding of why the engine would self-destruct.","Car mechanics, strays from main topic- Challenger",1,mistral,diversesumm,3.0
10,What were the benefits of using the billet main caps instead of regular ones?,4.0,4,3,explains why the regular caps were replaced with billet ones to keep from self-destructing,This question could give some context on how the new parts keep the engine from self-destructing.,"Car mechanics, strays from main topic- Challenger",1,mistral,diversesumm,3.6666666666666665
10,Did the new crank bearings improve the engine's efficiency?,3.0,3,3,does not increase my personal understanding,"This question is about specific mechanics of the car, which won't help my understanding of why the engine would self-destruct.","Article doesn't imply they increased efficiency, just that it was to keep engine from self destructing",1,mistral,diversesumm,3.0
13,What is the fuel tank capacity of the Demon 170?,4.0,4,4,gives more information about the car's specifications,"This question could give more context on the fuel efficiency of the 2023 Challenger, and how fast it is going through fuel.","Expands on information introduced, relates to Challengers specs",1,mistral,diversesumm,4.0
13,How long does it take to fill up the fuel tank of the Demon 170?,3.0,3,3,does not increase my personal understanding,This question will not help my understanding of why the fuel tank drains so quickly.,"Not relevant to article, this isn't a real way to measure car specs",1,mistral,diversesumm,3.0
13,Is the fuel pump capable of filling up the tank in under two minutes?,3.0,3,3,does not increase my personal understanding,This question will not help my understanding of why the fuel tank drains so quickly.,"Not relevant to article, this isn't a real way to measure car specs",1,mistral,diversesumm,3.0
13,What kind of fuel does the Demon 170 use?,4.0,5,5,important to explain the car's performance,This question could give important context on why the fuel efficiency is so low.,"Expands on information introduced, relates to Challengers specs",1,mistral,diversesumm,4.666666666666667
13,Is there a limit to how much fuel the Demon 170 can consume during acceleration?,3.0,3,2,does not increase my personal understanding,This question will not help my understanding of why the fuel tank drains so quickly.,"Answered in sentence 12- ""the fuel injectors can flow up to 164 gallons per hour""",1,mistral,diversesumm,2.6666666666666665
16,"What does the sentence mean by ""it'll run on premium gas""?",2.0,3,2,can be inferred from the sentence,This question should be inferred from the anchor sentence.,Meaning of common phrase,1,mistral,diversesumm,2.333333333333333
16,How much does the output fall to when running on premium gas?,2.0,2,2,answered by sentence 15,"This question is already answered in sentence 16, which explains how much the performance drops compared to full output.",Sentence 16 anwers this,1,mistral,diversesumm,2.0
16,What happens to the power output when using E85 fuel?,2.0,2,2,answered by sentence 17,"This question is already answered in sentence 15, which explains that running on E85 fuel lets the car give full power output.",Sentence 15 answers this,1,mistral,diversesumm,2.0
16,"What is meant by ""it'll run on premium gas, as well?""",2.0,3,2,can be inferred from the sentence,This question should be inferred from the anchor sentence.,Meaning of common phrase,1,mistral,diversesumm,2.333333333333333
16,What is the difference between regular gasoline and E85 fuel?,4.0,5,4,important to understand how these affect the car,"This question could give important context on why the car runs so much better on E85 fuel, and whether this was a specific design choice.",Expands on ideas introduced (different fuels being used),1,mistral,diversesumm,4.333333333333333
4,Who is Mary Ann and what role does she typically play in producing The Interchange?,4.0,4,5,explains who Mary Ann is,This question could provide some context on why Mary Ann was mentioned in this article.,Asks about new person introduced,2,gpt4,diversesumm,4.333333333333333
4,What is the usual content or topic that Mary Ann covers during her work weeks?,2.0,2,2,mostly answered by sentence 4,"This question is already somewhat answered in sentence 4, which explains that the Interchange is ment to report on news about fintech.","Sentence 4 answers ""fintech news""",2,gpt4,diversesumm,2.0
4,What is the reason for Mary Ann's break?,3.0,3,3,does not increase my personal understanding (given that this is an email/not a personal memo),"This question doesn't interest me, as it seems about the personal affairs of the person mentioned.","Asks question about person introduced, but seems off topic",2,gpt4,diversesumm,3.0
4,Who is the person writing this article and filling in for Mary Ann?,4.0,4,5,gives background on the writer,This question might give more context on how reliable this article is on fintech.,Asks about newly introduced person,2,gpt4,diversesumm,4.333333333333333
4,"What constitutes the ""hottest fintech news"" mentioned?",4.0,5,4,explains what topics are discussed,This question could give important context on what kind of subjects will be covered in the article.,Asks about information introduced- seems to be main topic,2,gpt4,diversesumm,4.333333333333333
7,What caused the Silicon Valley Bank to collapse?,5.0,5,5,essential question to understand why this is being written,This question could give important information on the reason behind the bank collapse.,"Asks about new/surprising events, would help me understand article",2,gpt4,diversesumm,5.0
7,When did the Silicon Valley Bank collapse happen?,4.0,4,4,gives more information about the bank collapse,This question could give some context on the timeline that the Interchange is receiving information.,Expands on information introduced,2,gpt4,diversesumm,4.0
7,How has the collapse of Silicon Valley Bank impacted the fintech industry?,5.0,5,5,important to understand the relationship between the collapse and what is being discussed,This question could give important context on why the bank collapse is mentioned in an article about fintech.,"Asks about information introduced, seems to relate to the main topic",2,gpt4,diversesumm,5.0
7,What information was revealed about the Silicon Valley Bank collapse since the last newsletter?,3.0,5,5,does not increase my personal understanding,This question gives important information on new developments about the bank collapse.,This newsletter seems to be all about catching up on Silicon Valley collapse developments,2,gpt4,diversesumm,4.333333333333333
