sentence_id,question,Keziah,Kathryn,Karim,Keziah reason,Kathryn reason,Karim reason,article_id,model,dataset,human_salience
1,How many global startups have been impacted by the collapse of SVB?,4.0,4,4,this question helps give more information about the bank collapse situation,,expands on info introduced,2,gpt4,diversesumm_summary,4.0
1,"In what way were the startups affected, besides some being unable to access their funds?",4.0,4,5,this question asks for additional information about the bank's collapse,This question could give more context to the scope of damage from the collapse.,"expands on info introduced, main topic",2,gpt4,diversesumm_summary,4.333333333333333
1,What are the names of the startups unable to access their funds due to the SVB collapse?,3.0,3,3,does not increase my personal understanding,The specific names of the startups won't help my understanding.,"don't need to know every name, if it had been asking for a name ould have rated higher",2,gpt4,diversesumm_summary,3.0
1,Are there measures being taken to enable these startups to regain access to their funds?,4.0,4,4,explains what is being done after the bank collapse,This question could explain what is being done to rectify the damage done.,"solution to problem presented, revolves around main topic",2,gpt4,diversesumm_summary,4.0
2,Which large U.S. banks specifically have reportedly injected money into First Republic Bank?,3.0,3,3,does not increase my personal understanding,The specific names of the banks won't help my understanding.,not super important for article comprehension,2,gpt4,diversesumm_summary,3.0
2,What was First Republic Bank's relationship or involvement with Silicon Valley Bank that caused it to be affected by its collapse?,4.0,5,5,this question gives context about the relationship between the two banks,This question could explain why the First Republic Bank is relevant to the collapse of the Sillicon Valley Bank.,"would help my personal understanding, clarifying question",2,gpt4,diversesumm_summary,4.666666666666667
2,How will this injection of $30 billion be used by First Republic Bank to combat the effects of SVB's collapse?,5.0,5,5,important to clarify what the purpose of the money is and how it can help,This question could explain how the 30 billion relates to steps taken to resolve the collapse of the bank.,"asking about action done by info introduced, related to main topic, asks the why",2,gpt4,diversesumm_summary,5.0
2,What are the reasons and motivations behind these large U.S. banks' decision to inject $30 billion into First Republic Bank?,2.0,4,5,answered by the anchor; it is to help after the bank collapse,This question could explain what the goal of the 30 billion injection is.,"clarifying the why, sticks close to the main topic",2,gpt4,diversesumm_summary,3.6666666666666665
2,"Was this $30 billion injection a collective decision amongst the large U.S. banks, or separate, individual investments?",3.0,4,3,does not increase my personal understanding,This question could give context to why these banks agreed to give so much money to the First Republic Bank.,details,2,gpt4,diversesumm_summary,3.333333333333333
3,"What exactly are the ""African homegrown solutions"" DFS Lab is advocating for in response to SVB's collapse?",5.0,5,5,asks for clarification about the African homegrown solutions that are relevant to the bank collapse,This question could explain how DFS Lab plans to make imporvements on the situation.,clarifying question on info introduced,2,gpt4,diversesumm_summary,5.0
3,What potential implications could the SVB's collapse have on Africa-focused startups and how is DFS Lab planning to circumvent this?,4.0,4,4,important to understand how the startups in Africa could be affected and how the homegrowns solutions could help,This question could give more context to why DFS labs is involved in the Sillicon Valley Bank collapse.,both are expanding questions based on info introduced,2,gpt4,diversesumm_summary,4.0
3,What is the role and impact of DFS Lab in Africa's venture capital and start-up ecosystem?,3.0,3,3,does not increase my personal understanding,This question isn't directly related to the bank collapse so I'm not interested in it.,ecosystem as a whole is extra info,2,gpt4,diversesumm_summary,3.0
3,What inspired DFS Lab to specifically focus on Africa? Are they involved in any other regions as well?,3.0,3,3,does not increase my personal understanding,"The question doesn't interest me, as it doesn't really relate to the Sillicon Valley Bank collapse. ",both extra info,2,gpt4,diversesumm_summary,3.0
3,How is the firm's current portfolio of startups responding or adapting to the SVB fallout according to DFS Lab's commentary?,3.0,4,4,does not increase my personal understanding,This question could give more explanation to how DFS Lab hopes to solve the incident.,asks expanding question on information introduced,2,gpt4,diversesumm_summary,3.6666666666666665
1,What specific threats does Sam Altman highlight in regards to AI technology like ChatGPT?,5.0,5,5,this question asks for more context about the specific threats the article is referring to,This question gives important information on reasons why AI regulation would be needed.,"expanding question, related to main idea, helps understanding",3,gpt4,diversesumm_summary,5.0
1,How can the AI technology ChatGPT be beneficial according to OpenAI's CEO?,5.0,5,5,"this question asks for more information about the referenced ""benefits"" of AI",This question gives important information on why AI should continue to be developed.,"expanding question, related to main idea, helps understanding",3,gpt4,diversesumm_summary,5.0
1,What's the role of Sam Altman in OpenAI and how did he contribute to the development of AI technologies like ChatGPT?,3.0,3,3,Altman's role is partially answered in the anchor & does not increase personal understanding,"I'm not interested in this question, as sentence 1 already explains tht Sam Altman is the CEO of OpenAI, and more information won't necessarily help my understanding. ","first question answered, second question, wouldn't be super helpful for my overall understanding",3,gpt4,diversesumm_summary,3.0
1,What is ChatGPT and how is it applied in the field of AI technology?,3.0,4,4,does not increase my personal understanding and the question about Altman's role is answered in the anchor,This question could give some context on the main subject of the article and why it is being discussed.,expanding question on information introduced,3,gpt4,diversesumm_summary,3.6666666666666665
1,What is Sam Altman's perspective on the regulation of AI technologies such as ChatGPT?,4.0,4,5,this question contextualizes what Altman thinks about AI regulation,This question could give some context on why Sam Altman is listing the threats and benefits of AI technology.,"asks about human inftroduced, related to main idea",3,gpt4,diversesumm_summary,4.333333333333333
2,What types of misinformation could potentially be spread through AI technology such as ChatGPT?,3.0,3,4,does not increase my personal understanding & is not the focus of the context,Knowing the specific type of misinformation won't necessarily help my understanding.,"could affect severity of concern, expanding question on info introduced",3,gpt4,diversesumm_summary,3.333333333333333
2,How might AI like ChatGPT aid in cyberattacks and what could be the possible implications of this?,4.0,4,4,asks for the impact of these downsides of AI (specifically cybersecurity),This question could give some context on the problem about cyberattacks and how it could potentially be fixed.,"could affect severity of concern, expanding question on info introduced",3,gpt4,diversesumm_summary,4.0
2,Can you explain more specifically how AI technology could contribute to job loss?,3.0,4,4,does not increase my personal understanding,This question could give some context on the problem about job loss and how it could potentially be fixed.,"could affect severity of concern, expanding question on info introduced",3,gpt4,diversesumm_summary,3.6666666666666665
2,What industries do they predict to be most affected by job loss due to the advancement of AI technology?,3.0,4,4,does not increase my personal understanding,This question could give some context to better understand how AI will affect the job market.,"close to main topic, expands on idea introduced",3,gpt4,diversesumm_summary,3.6666666666666665
2,Is there a plan in place to mitigate the concerns of potential aiding in cyberattacks and job loss due to AI technology?,4.0,5,4,asks about what is being done to combat these negative implications of AI,This question gives important information on the potential solutions to the problems listed out in sentence 2.,"expnding question, if i had more article context might rate higher ",3,gpt4,diversesumm_summary,4.333333333333333
3,What specific feedback mechanisms does OpenAI have in place to ensure safe engagement with AI technology like ChatGPT?,5.0,4,4,important to understand what regulations and safety features are currently in place,This question could give some information on the steps OpenAI is taking to lower the risk of AI technology.,expands on info introduced,3,gpt4,diversesumm_summary,4.333333333333333
3,"How is regulation being implemented in the use of AI technology, and who is responsible for setting these regulations?",5.0,5,5,important to understand what regulations and safety features are currently in place and who is behind these,This question gives important information on how the risks of AI technology could be mitigated.,"first question is a 5, relates to main topic, who is responsible i don't care as much about, still an expanding question so 4",3,gpt4,diversesumm_summary,5.0
3,"In what specific ways could AI technology, like ChatGPT, provide considerable value to the education sector?",3.0,4,4,not the main focus of the article & does not increase my personal understanding,This question could provide some context on why AI technology is still being developed dispite the risks.,"expanding question, reasons why risks mentioned previously would be worth it",3,gpt4,diversesumm_summary,3.6666666666666665
3,How would AI technology impact and potentially revolutionize healthcare?,3.0,4,4,not the main focus of the article & does not increase my personal understanding,This question could provide some context on why AI technology is still being developed dispite the risks.,"expanding question, could sway narritive, prove risks are worth it",3,gpt4,diversesumm_summary,3.6666666666666665
3,"What measures are in place to ensure AI technology, while providing value in education and healthcare, doesn't compromise on confidentiality and security?",5.0,5,5,important to understand what is currently being done to regulate AI usage in terms of privacy and security,This question gives important information on how the risks of AI technology could be mitigated.,"could sway narritive,  main idea",3,gpt4,diversesumm_summary,5.0
1,What are the major insulin products that Eli Lilly & Co. produces?,5.0,3,3,asks for additional information about a key part of the article,Knowing the specific products won't necessarily help my understanding.,"details, don't need to know specific medicines produced",4,gpt4,diversesumm_summary,3.6666666666666665
1,What were the previous prices of Eli Lilly & Co.'s insulin products before the reduction?,4.0,4,4,important to understand how much prices have been reduced,This question could give some context on why these insulin products needed a price cut.,"contrast makes sense, expands on info introduced",4,gpt4,diversesumm_summary,4.0
1,What prompted Eli Lilly & Co. to announce a cut in prices for its major insulin products?,5.0,5,5,important to understand the motivation behind the price cuts,This question gives important information on the motivation behind cutting prices for the insulin products.,"asks the why on information introduced, could influence narritive",4,gpt4,diversesumm_summary,5.0
1,How much of a price cut is Eli Lilly & Co. implementing on its major insulin products?,4.0,4,4,important to understand how much prices have been reduced,This question could give some context on the impact the cut will have on sales.,"equivlent on previous question, background info on ideas introduced",4,gpt4,diversesumm_summary,4.0
1,How will this price reduction impact the overall profits of Eli Lilly & Co.?,3.0,5,4,does not increase my personal understanding,This question gives important information on the potential drawbacks of the price cut.,"expanding question, could reason why decision was made",4,gpt4,diversesumm_summary,4.0
2,What were the previous prices of Lilly's popular insulins and its Lispro generic?,4.0,4,4,important to understand how much prices have been reduced,This question could give some context on how severe the price cuts were.,"could help quantify how much of a reduction company made, if no previous knowledge of insulin prices in america",4,gpt4,diversesumm_summary,4.0
2,How will the price reduction to $35 and $25 affect Eli Lilly & Co.'s revenue?,4.0,5,4,important to understand the impact on the business (more relevant up until this context than when it was asked anchored in sentence 1),This question gives important information on the potential drawbacks of the price cut.,"expanding question, could reason why decision was made",4,gpt4,diversesumm_summary,4.333333333333333
2,Can the lower costs of Lilly's insulins be sustained in the long-term?,4.0,5,4,important to understand if these price changes will last long-term,"This question gives important information on the goal of the price cuts, and whether this is a long term deal.",expanding question,4,gpt4,diversesumm_summary,4.333333333333333
2,How do these new prices compare to the costs of other competing insulin products in the market?,3.0,4,3,does not increase my personal understanding & not the focus of the article,This question could give some context on the insulin market and whether this behavior is expected.,article seems to focus on eli lilly only,4,gpt4,diversesumm_summary,3.333333333333333
2,What prompted Eli Lilly & Co. to decide on these specific new pricing structures for their insulin products?,4.0,5,5,important to understand the motivation behind the price cuts,This question gives important information on the motivation behind cutting prices for the insulin products.,the why behind decision introduced,4,gpt4,diversesumm_summary,4.666666666666667
3,What is the federal rule that penalises high prices for Medicaid?,3.0,3,3,this question is slightly redundant & the specific rule/policy does not increase my personal understanding,"The rule can be inferred from sentence 3, and knowing more specific information won't necessarily help my understanding. ",name doesn't seem too important,4,gpt4,diversesumm_summary,3.0
3,How exactly can lowering prices save Lilly money due to the mentioned federal rule?,2.0,5,2,"answered by sentence 3 (they are penalized for charging high prices, so it is assumed lowering prices will be cheaper than paying the penality) ",This question gives important infomration on how the federal rule is relevant to the price cuts.,stated in sentence,4,gpt4,diversesumm_summary,3.0
3,Could the price reduction have potential impacts on the company's revenue and profit margins?,3.0,4,4,somewhat answered & does not increase my personal understanding,"This question is somewhat answered in sentence 3, but it would be helpful to understand the long term costs. ",expnding question based on introduction,4,gpt4,diversesumm_summary,3.6666666666666665
3,What is the general reaction from analysts to this decision by Lilly?,3.0,2,3,some analyst reaction is described & does not increase my personal understanding,Sentence 3 already gives the response from analysts and knowing more specifics about their feelings on the sucject won't necessarily help my understanding.,"alredy given, don't need further reaction",4,gpt4,diversesumm_summary,2.6666666666666665
3,"Does this federal rule solely apply to Medicaid, or does it impact other programmes and sectors within the healthcare industry?",3.0,3,3,not the focus of the article & does not increase my personal understanding,"Since sentence 3 explicitly states that the rule applies to Medicaid, it can be inferred that it only applies to medicaid, and the question doesn't directly relate to the main subject. ",off-topic,4,gpt4,diversesumm_summary,3.0
1,What specific factors contributed to the 87% fall in natural gas prices since August 2022?,5.0,5,5,this is essential to understanding the cause of the gas price fall,This question gives important reasoning on the fall in gas prices.,"The why behind information introduced, aids my understanding",5,gpt4,diversesumm_summary,5.0
1,"How have Poland, Hungary, and the Czech Republic specifically benefited from the drop in natural gas prices?",4.0,3,3,important to understand how they were positively impacted,"I'm not interested in this question, as the answer can be mostly inferred. ","""positively impacted"" is enough implication to know its economic, we won't get much more than that",5,gpt4,diversesumm_summary,3.333333333333333
1,Has the fallen natural gas prices affected other industries within these central European countries?,4.0,4,4,important to understand if the gas prices have affected other areas of the economy,This question could give some context to how gas prices affect the general economy.,"Expands on idea introduced, would affect general impact of gas price decline",5,gpt4,diversesumm_summary,4.0
1,Were there any measures taken by these central European countries to manage the high natural gas prices when they were at their peak in August 2022?,3.0,4,4,does not increase my personal understanding,This question could give some context on the situation in Europe when gas prices were high.,"Background context on idea introduced, would help understand issue",5,gpt4,diversesumm_summary,3.6666666666666665
1,"How does the drop in natural gas prices relate to the economic relations between these central European countries and Russia, particularly in the context of the invasion of Ukraine?",0.0,0,0,anchored in sentence 2,This question gives important context on the relation to gas prices and their effect on the liisted European countries. (leakage from sentence 2),Anchored sentence 2,5,gpt4,diversesumm_summary,0.0
2,What are the various risks that still persist despite the fall in natural gas prices?,3.0,4,5,does not increase my personal understanding and is not related to the main point of the article,This question could give some context on the general economic problems in the region.,"Clarifies on info introduced, expands, helps me understand ideas implied in sentence",5,gpt4,diversesumm_summary,4.0
2,How exactly has the decrease in natural gas prices eased inflation concerns?,3.0,3,3,does not increase my personal understanding; the answer can be inferred by the context,"I'm not interested in this question, as the answer can be mostly inferred.","Don't need to know how, we can assume lower gas prices help ease inflation in general",5,gpt4,diversesumm_summary,3.0
2,Which emerging markets have been significantly powered by the fall in natural gas prices and in what ways?,4.0,4,4,gives more infrmation about the impact of gas prices falling,This question could give some context on how gas prices impact the economy.,Expands on info introduced,5,gpt4,diversesumm_summary,4.0
2,Can you provide more detail on how the decrease in prices provided relief from the economic strains induced by Russia's invasion of Ukraine?,3.0,3,3,does not increase my personal understanding; the answer can be inferred by the context,"I'm not interested in this question, as the answer can be mostly inferred.","Decrease in gas prices is exactly how, don't need more info",5,gpt4,diversesumm_summary,3.0
2,What are the future predictions for natural gas prices and their potential impact on inflation and emerging markets?,4.0,5,3,asks about long-term impact of the gas prices,This question gives important information on how gas prices look in the long term. and whether this relief will last.,Don't need to know about other events to understand article,5,gpt4,diversesumm_summary,4.0
1,What specific financial pressures are Canadian Somalis facing as they try to support their relatives in Somalia?,3.0,3,2,does not increase my understanding & can be inferred from the context,I'm not interested in this question as it can be inferred that Canadian Somalis are facing pressure to send money back home.,It is the support they have to give that puts additional strain on them,6,gpt4,diversesumm_summary,2.6666666666666665
1,How severe is the drought in Somalia and how is it affecting the livelihoods of the people living there?,3.0,3,4,does not increase my understanding & can be inferred from the context,"I'm not interested in this question, as the situation in Somalia can be mostly inferred and it doesn't help my understanding of the situation for Canadian Somalis. ","Expanding information, would help understand why its affecting relatives in canada so much",6,gpt4,diversesumm_summary,3.333333333333333
1,How is the Canadian government responding to the financial strains impacting the Somali community in Canada?,2.0,5,2,the government is not mentioned in the article; the question is somewhat unrelated,This question gives important information on the reaction of the Canadian government to the situation.,Canadian government not mentioned or implied yet,6,gpt4,diversesumm_summary,3.0
1,Are there any organized efforts or aid programs within the Canadian Somali community to help alleviate these financial pressures?,3.0,5,4,does not increase my personal understanding,This question gives important information on whether there are any solutions to this situation.,Expands on info introduced,6,gpt4,diversesumm_summary,4.0
1,How many Canadian Somalis are directly impacted by the financial pressure due to the drought in Somalia?,4.0,4,4,this question gives context to how severe the issue is,This question could give some context on how severe the situation is in Somali communities in Canada.,"Expanding info, could put into perspective the severity of the issue",6,gpt4,diversesumm_summary,4.0
2,What is causing the changes in climate that have led to a lack of rain in Somalia?,3.0,3,3,does not increase my understanding & an answer can be inferred,I'm not interested in this question as it can be inferred that the changes in climate occur because of global warming.,"Could have rated diff if article kept going/was implied to talk about those reasons, as of now there is no need to know further details",6,gpt4,diversesumm_summary,3.0
2,How significantly has the loss of livestock affected the livelihoods of families in Somalia?,2.0,2,2,answered by the anchor (food insecurity),"This question is already answered in sentence 2, which explain that there is an unprecedented food insecurity for almost 8 million people. ",Answered in sentence 2 at end,6,gpt4,diversesumm_summary,2.0
2,By what percentage have food prices increased due to the worsening drought?,4.0,4,4,this question provides context on how the drought and food prices are related,This question could give some context on how much the situation has gotten worse.,"Expands on info introduced, could show severity of situation",6,gpt4,diversesumm_summary,4.0
2,How is the unprecedented level of food insecurity being addressed by the government and humanitarian organizations in Somalia?,4.0,5,4,asks for additional context about what is being done to alleviate the situation,This question gives important information on how this situation is being resolved.,"4 because it is only implied entity, but this would help my undertanding/ it expands on idea introduced",6,gpt4,diversesumm_summary,4.333333333333333
2,How does this food insecurity affecting nearly eight million people compare to previous instances of drought and food scarcity in the country?,3.0,3,4,does not increase my understanding & unrelated to the main focus of the article,I'm not interested in this question as previous incidnets of food scarcity won't necessarily help my understanding of the current incident.,"Background info, could show how severe the new change in weather is",6,gpt4,diversesumm_summary,3.333333333333333
1,"What specific genetic evidence indicates that SARS-CoV-2 originated in animals, more specifically raccoon dogs?",5.0,5,5,asks for important context of a situation introducted in the article,This question gives important information on why the virus originated in raccoon dogs and the reliability of the evidence.,"Clarifying question, would help my understanding and increase credibility ",7,gpt4,diversesumm_summary,5.0
1,How are raccoon dogs differentiated from other animals in terms of their potential role in the spread of SARS-CoV-2?,2.0,2,2,answered in sentence 1,"This question is already answered in sentence 1, which explains that raccoon dogs are thought to be the animal origin of SARS-CoV-2.",Sentence 1 starts with this,7,gpt4,diversesumm_summary,2.0
1,"How prevalent were raccoon dogs in the Huanan Seafood Wholesale Market in Wuhan, and what role did the market play in the early stages of the pandemic?",3.0,3,4,does not increase my personal understanding of the article & is somewhat answered by the context,"I'm not interested in this question as the role of the market in spreading the virus is already explained in sentence 1, and more information is not necessary to understanding the situation.","Multiple questions, 4 would help increase evidence, 4 would aid main argument, given that it did have a role ",7,gpt4,diversesumm_summary,3.333333333333333
